Enter password: ****
Welcome to the MySQL monitor.  Commands end with ; or \g.
Your MySQL connection id is 27
Server version: 8.0.11 MySQL Community Server - GPL

Copyright (c) 2000, 2018, Oracle and/or its affiliates. All rights reserved.

Oracle is a registered trademark of Oracle Corporation and/or its
affiliates. Other names may be trademarks of their respective
owners.

Type 'help;' or '\h' for help. Type '\c' to clear the current input statement.

mysql> use prim
Database changed
mysql> select * from prim;
+----+-------------------+-------+------------+----------------+
| id | name              | Bal   | DOB        | city           |
+----+-------------------+-------+------------+----------------+
|  1 | Random Stranger 1 | 25000 | 1998-01-20 | yogi ka shahar |
|  2 | Changed           |  2500 | 1998-01-10 | yogi ka shahar |
|  5 | Random Stranger 5 |  2000 | 1998-10-14 | yogi ka shahar |
|  8 | Random Stranger 8 |  2000 | 1998-10-02 | yogi shahar    |
+----+-------------------+-------+------------+----------------+
4 rows in set (0.00 sec)

mysql> alter table prim add(code int(20)not null);
Query OK, 0 rows affected (1.13 sec)
Records: 0  Duplicates: 0  Warnings: 0

mysql> select * from prim;
+----+-------------------+-------+------------+----------------+------+
| id | name              | Bal   | DOB        | city           | code |
+----+-------------------+-------+------------+----------------+------+
|  1 | Random Stranger 1 | 25000 | 1998-01-20 | yogi ka shahar |    0 |
|  2 | Changed           |  2500 | 1998-01-10 | yogi ka shahar |    0 |
|  5 | Random Stranger 5 |  2000 | 1998-10-14 | yogi ka shahar |    0 |
|  8 | Random Stranger 8 |  2000 | 1998-10-02 | yogi shahar    |    0 |
+----+-------------------+-------+------------+----------------+------+
4 rows in set (0.00 sec)

mysql> update prim set code=273005 where id=1;
Query OK, 1 row affected (0.12 sec)
Rows matched: 1  Changed: 1  Warnings: 0

mysql> select * from prim;
+----+-------------------+-------+------------+----------------+--------+
| id | name              | Bal   | DOB        | city           | code   |
+----+-------------------+-------+------------+----------------+--------+
|  1 | Random Stranger 1 | 25000 | 1998-01-20 | yogi ka shahar | 273005 |
|  2 | Changed           |  2500 | 1998-01-10 | yogi ka shahar |      0 |
|  5 | Random Stranger 5 |  2000 | 1998-10-14 | yogi ka shahar |      0 |
|  8 | Random Stranger 8 |  2000 | 1998-10-02 | yogi shahar    |      0 |
+----+-------------------+-------+------------+----------------+--------+
4 rows in set (0.00 sec)

mysql> SELECT name FROM prim WHERE name REGEXP 'Ra$';
Empty set (0.04 sec)

mysql> SELECT name FROM prim WHERE name REGEXP 'om';
+-------------------+
| name              |
+-------------------+
| Random Stranger 1 |
| Random Stranger 5 |
| Random Stranger 8 |
+-------------------+
3 rows in set (0.00 sec)

mysql> SELECT name FROM prim WHERE name REGEXP 'Ra$';
Empty set (0.00 sec)

mysql> SELECT name FROM prim WHERE name REGEXP '^Ra';
+-------------------+
| name              |
+-------------------+
| Random Stranger 1 |
| Random Stranger 5 |
| Random Stranger 8 |
+-------------------+
3 rows in set (0.00 sec)

mysql> alter table prim modify column Bal int(20);
Query OK, 0 rows affected (0.15 sec)
Records: 0  Duplicates: 0  Warnings: 0

mysql> alter table prim modify column Bal varcchar(30);
ERROR 1064 (42000): You have an error in your SQL syntax; check the manual that corresponds to your MySQL server version
 for the right syntax to use near 'varcchar(30)' at line 1
mysql> alter table prim modify column Bal varchar(30);
Query OK, 4 rows affected (0.84 sec)
Records: 4  Duplicates: 0  Warnings: 0

mysql> select * from prim;
+----+-------------------+-------+------------+----------------+--------+
| id | name              | Bal   | DOB        | city           | code   |
+----+-------------------+-------+------------+----------------+--------+
|  1 | Random Stranger 1 | 25000 | 1998-01-20 | yogi ka shahar | 273005 |
|  2 | Changed           | 2500  | 1998-01-10 | yogi ka shahar |      0 |
|  5 | Random Stranger 5 | 2000  | 1998-10-14 | yogi ka shahar |      0 |
|  8 | Random Stranger 8 | 2000  | 1998-10-02 | yogi shahar    |      0 |
+----+-------------------+-------+------------+----------------+--------+
4 rows in set (0.00 sec)

mysql> alter table prim modify column city int(20);
ERROR 1366 (HY000): Incorrect integer value: 'yogi ka shahar' for column 'city' at row 1
mysql> alter table prim add (country varchar(30));
Query OK, 0 rows affected (0.91 sec)
Records: 0  Duplicates: 0  Warnings: 0

mysql> select * from prim;
+----+-------------------+-------+------------+----------------+--------+---------+
| id | name              | Bal   | DOB        | city           | code   | country |
+----+-------------------+-------+------------+----------------+--------+---------+
|  1 | Random Stranger 1 | 25000 | 1998-01-20 | yogi ka shahar | 273005 | NULL    |
|  2 | Changed           | 2500  | 1998-01-10 | yogi ka shahar |      0 | NULL    |
|  5 | Random Stranger 5 | 2000  | 1998-10-14 | yogi ka shahar |      0 | NULL    |
|  8 | Random Stranger 8 | 2000  | 1998-10-02 | yogi shahar    |      0 | NULL    |
+----+-------------------+-------+------------+----------------+--------+---------+
4 rows in set (0.00 sec)

mysql> update prim set country='India' where id=1;
Query OK, 1 row affected (0.16 sec)
Rows matched: 1  Changed: 1  Warnings: 0

mysql> select * from prim;
+----+-------------------+-------+------------+----------------+--------+---------+
| id | name              | Bal   | DOB        | city           | code   | country |
+----+-------------------+-------+------------+----------------+--------+---------+
|  1 | Random Stranger 1 | 25000 | 1998-01-20 | yogi ka shahar | 273005 | India   |
|  2 | Changed           | 2500  | 1998-01-10 | yogi ka shahar |      0 | NULL    |
|  5 | Random Stranger 5 | 2000  | 1998-10-14 | yogi ka shahar |      0 | NULL    |
|  8 | Random Stranger 8 | 2000  | 1998-10-02 | yogi shahar    |      0 | NULL    |
+----+-------------------+-------+------------+----------------+--------+---------+
4 rows in set (0.00 sec)

mysql> update prim set country='India' where id=2;
Query OK, 1 row affected (0.13 sec)
Rows matched: 1  Changed: 1  Warnings: 0

mysql> update prim set country='India' where id=5 or Bal=2000;
Query OK, 2 rows affected (0.16 sec)
Rows matched: 2  Changed: 2  Warnings: 0

mysql> select * from prim;
+----+-------------------+-------+------------+----------------+--------+---------+
| id | name              | Bal   | DOB        | city           | code   | country |
+----+-------------------+-------+------------+----------------+--------+---------+
|  1 | Random Stranger 1 | 25000 | 1998-01-20 | yogi ka shahar | 273005 | India   |
|  2 | Changed           | 2500  | 1998-01-10 | yogi ka shahar |      0 | India   |
|  5 | Random Stranger 5 | 2000  | 1998-10-14 | yogi ka shahar |      0 | India   |
|  8 | Random Stranger 8 | 2000  | 1998-10-02 | yogi shahar    |      0 | India   |
+----+-------------------+-------+------------+----------------+--------+---------+
4 rows in set (0.00 sec)

mysql> select name,id from prim where Bal>2000;
+-------------------+----+
| name              | id |
+-------------------+----+
| Random Stranger 1 |  1 |
| Changed           |  2 |
+-------------------+----+
2 rows in set (0.00 sec)

mysql> select name,id from prim where Bal>2500 or Bal<=2000;
+-------------------+----+
| name              | id |
+-------------------+----+
| Random Stranger 1 |  1 |
| Random Stranger 5 |  5 |
| Random Stranger 8 |  8 |
+-------------------+----+
3 rows in set (0.00 sec)

mysql> select name,id from prim where Bal not between 2500 and 2000;
+-------------------+----+
| name              | id |
+-------------------+----+
| Random Stranger 1 |  1 |
| Changed           |  2 |
| Random Stranger 5 |  5 |
| Random Stranger 8 |  8 |
+-------------------+----+
4 rows in set (0.00 sec)

mysql> select name,id from prim where Bal not between 2500 and 200;
+-------------------+----+
| name              | id |
+-------------------+----+
| Random Stranger 1 |  1 |
| Changed           |  2 |
| Random Stranger 5 |  5 |
| Random Stranger 8 |  8 |
+-------------------+----+
4 rows in set (0.00 sec)

mysql> select name,id from prim where Bal not between 2500 and 20000;
+-------------------+----+
| name              | id |
+-------------------+----+
| Random Stranger 1 |  1 |
| Random Stranger 5 |  5 |
| Random Stranger 8 |  8 |
+-------------------+----+
3 rows in set (0.00 sec)

mysql> select name,id from prim where code in (273005,0);
+-------------------+----+
| name              | id |
+-------------------+----+
| Random Stranger 1 |  1 |
| Changed           |  2 |
| Random Stranger 5 |  5 |
| Random Stranger 8 |  8 |
+-------------------+----+
4 rows in set (0.00 sec)

mysql> select name,id from prim where code in (273005);
+-------------------+----+
| name              | id |
+-------------------+----+
| Random Stranger 1 |  1 |
+-------------------+----+
1 row in set (0.00 sec)

mysql> select name,id from prim where code not in (273005);
+-------------------+----+
| name              | id |
+-------------------+----+
| Changed           |  2 |
| Random Stranger 5 |  5 |
| Random Stranger 8 |  8 |
+-------------------+----+
3 rows in set (0.00 sec)

mysql> alter table prim modify column id int(20);
Query OK, 4 rows affected (0.81 sec)
Records: 4  Duplicates: 0  Warnings: 0

mysql> alter table prim modify column name varchar(40) auto_increment primary key;
ERROR 1063 (42000): Incorrect column specifier for column 'name'
mysql> insert into prim values(1,'Name',2300,'1998-10-10','yogi'273005,'India')
    -> ;
ERROR 1064 (42000): You have an error in your SQL syntax; check the manual that corresponds to your MySQL server version
 for the right syntax to use near '273005,'India')' at line 1
mysql> insert into prim values(1,'Name',2300,'1998-10-10','yogi',273005,'India')
    -> ;
ERROR 1062 (23000): Duplicate entry '1' for key 'PRIMARY'
mysql> primary key(name, DOB)
    -> ;
ERROR 1064 (42000): You have an error in your SQL syntax; check the manual that corresponds to your MySQL server version
 for the right syntax to use near 'primary key(name, DOB)' at line 1
mysql> desc prim;
+---------+-------------+------+-----+---------+-------+
| Field   | Type        | Null | Key | Default | Extra |
+---------+-------------+------+-----+---------+-------+
| id      | int(20)     | NO   | PRI | NULL    |       |
| name    | varchar(40) | YES  |     | NULL    |       |
| Bal     | varchar(30) | YES  |     | NULL    |       |
| DOB     | date        | YES  |     | NULL    |       |
| city    | varchar(40) | YES  |     | NULL    |       |
| code    | int(20)     | NO   |     | NULL    |       |
| country | varchar(30) | YES  |     | NULL    |       |
+---------+-------------+------+-----+---------+-------+
7 rows in set (0.06 sec)

mysql> create table new(id int, name varchar(40),Bal int,primaerykey(id, name, Bal));
ERROR 1064 (42000): You have an error in your SQL syntax; check the manual that corresponds to your MySQL server version
 for the right syntax to use near '(id, name, Bal))' at line 1
mysql> create table new(id int, name varchar(40),Bal int,primarykey(id, name, Bal));
ERROR 1064 (42000): You have an error in your SQL syntax; check the manual that corresponds to your MySQL server version
 for the right syntax to use near '(id, name, Bal))' at line 1
mysql> create table new(id int, name varchar(40),Bal int,primary key(id, name, Bal));
Query OK, 0 rows affected (0.31 sec)

mysql> desc new;
+-------+-------------+------+-----+---------+-------+
| Field | Type        | Null | Key | Default | Extra |
+-------+-------------+------+-----+---------+-------+
| id    | int(11)     | NO   | PRI | NULL    |       |
| name  | varchar(40) | NO   | PRI | NULL    |       |
| Bal   | int(11)     | NO   | PRI | NULL    |       |
+-------+-------------+------+-----+---------+-------+
3 rows in set (0.00 sec)

mysql> insert into values(1,'New Stranger',1000);
ERROR 1064 (42000): You have an error in your SQL syntax; check the manual that corresponds to your MySQL server version
 for the right syntax to use near 'values(1,'New Stranger',1000)' at line 1
mysql> insert into new values(1,'New Stranger',1000);
Query OK, 1 row affected (0.11 sec)

mysql> insert into new values(1,'New Stranger',1000);
ERROR 1062 (23000): Duplicate entry '1-New Stranger-1000' for key 'PRIMARY'
mysql> insert into new values(2,'New Stranger',1000);
Query OK, 1 row affected (0.10 sec)

mysql> create table new1(id int, name varchar(40),Bal int,primary key(name, Bal));
Query OK, 0 rows affected (0.40 sec)

mysql> insert into new1 values(1,'New Stranger',1000);
Query OK, 1 row affected (0.05 sec)

mysql> insert into new1 values(2,'New Stranger',1000);
ERROR 1062 (23000): Duplicate entry 'New Stranger-1000' for key 'PRIMARY'
mysql> insert into new1 values(2,'New Stranger 2',1000);
Query OK, 1 row affected (0.10 sec)

mysql> insert into new1 values(2,'New Stranger 2',10000);
Query OK, 1 row affected (0.07 sec)

mysql> select * from new1;
+------+----------------+-------+
| id   | name           | Bal   |
+------+----------------+-------+
|    1 | New Stranger   |  1000 |
|    2 | New Stranger 2 |  1000 |
|    2 | New Stranger 2 | 10000 |
+------+----------------+-------+
3 rows in set (0.00 sec)

mysql> create table prac(id int auto_increment, name varchar(40));
ERROR 1075 (42000): Incorrect table definition; there can be only one auto column and it must be defined as a key
mysql> CREATE TABLE Persons (
    ->     ID int IDENTITY(1,1) PRIMARY KEY,
    ->     LastName varchar(255) NOT NULL,
    ->     FirstName varchar(255),
    ->     Age int
    -> );
ERROR 1064 (42000): You have an error in your SQL syntax; check the manual that corresponds to your MySQL server version
 for the right syntax to use near 'IDENTITY(1,1) PRIMARY KEY,
    LastName varchar(255) NOT NULL,
    FirstName var' at line 2
mysql> create table qwer(id int identity(1,1) primary key, name varchar(40));
ERROR 1064 (42000): You have an error in your SQL syntax; check the manual that corresponds to your MySQL server version
 for the right syntax to use near 'identity(1,1) primary key, name varchar(40))' at line 1
mysql> CREATE TABLE Persons (
    ->     ID int NOT NULL AUTO_INCREMENT,
    ->     LastName varchar(255) NOT NULL,
    ->     FirstName varchar(255),
    ->     Age int,
    ->     PRIMARY KEY (ID)
    -> );
Query OK, 0 rows affected (0.29 sec)

mysql> desc Persons
    -> ;
+-----------+--------------+------+-----+---------+----------------+
| Field     | Type         | Null | Key | Default | Extra          |
+-----------+--------------+------+-----+---------+----------------+
| ID        | int(11)      | NO   | PRI | NULL    | auto_increment |
| LastName  | varchar(255) | NO   |     | NULL    |                |
| FirstName | varchar(255) | YES  |     | NULL    |                |
| Age       | int(11)      | YES  |     | NULL    |                |
+-----------+--------------+------+-----+---------+----------------+
4 rows in set (0.00 sec)

mysql> insert into Person values(1,'name','fname',18);
ERROR 1146 (42S02): Table 'prim.person' doesn't exist
mysql> use Person;
ERROR 1049 (42000): Unknown database 'person'
mysql>
